{
	"general": {
		"embed_color": 14908858,
		"mute": {
			"role": 953984696491061289,
			"take": [996121272897519687, 965267139902705744, 995126555867086938, 965270054633619476]
		},
		"media_channels": [954148665646260314],
		"logging_channel": 1027892160797872179
	},
	"administrators": {
		"roles": [955220417969262612],
		"users": [737323631117598811]
	},
	"thread_introductions": [
		{
			"channels": [985666124068814888],
			"response": {
				"message": "Hi. Please wait for someone to help you with your problem.\r\nUnderstand that this channel is only meant to help you.\r\nIf you encounter a bug, please report it on the respective GitHub repository instead.\r\n\r\nThank you!"
			}
		}
	],
	"message_responses": [
		{
			"includes": {
				"channels": [952946952348270626, 954147049832603748],
				"match": ["(?i)(((where|how|download|install|get|manager).*){2,})"]
			},
			"excludes": {
				"roles": [
					965267139902705744, 955220417969262612, 952987191401926697,
					1027874293192863765
				],
				"match": ["(?i)patch", "(?i)error"]
			},
			"condition": {
				"user": {
					"server_age": 120
				}
			},
			"response": {
				"embed": {
					"title": "Where or how to get ReVanced ‚ùì",
					"description": "You have asked a question that has been answered in the <#953993848374325269> channel already. Make sure to read it as it will answer a lot of your questions guaranteed.",
					"color": 14908858,
					"fields": [
						{
							"name": "üî∏ Regarding your question",
							"value": "Please refer to <#953993848374325269> `III`.",
							"inline": false
						}
					],
					"footer": {
						"text": "",
						"icon_url": ""
					},
					"image": {
						"url": ""
					},
					"thumbnail": {
						"url": "https://cdn.discordapp.com/icons/952946952348270622/d011f1dc1d27e9001d243bdedaf7443b.webp?size=512"
					},
					"author": {
						"name": "",
						"icon_url": "",
						"url": ""
					}
				}
			}
		},
		{
			"includes": {
				"channels": [952946952348270626, 954147049832603748],
				"match": ["(?i)(((error|open|patch).*){2,})"]
			},
			"excludes": {
				"roles": [
					965267139902705744, 955220417969262612, 952987191401926697,
					1027874293192863765
				],
				"match": []
			},
			"condition": {
				"user": {
					"server_age": 120
				}
			},
			"response": {
				"embed": {
					"title": "Where or how to get ReVanced ‚ùì",
					"description": "You have asked a question that has been answered in the <#953993848374325269> channel already. Make sure to read it as it will answer a lot of your questions guaranteed.",
					"color": 14908858,
					"fields": [
						{
							"name": "üî∏ Regarding your question",
							"value": "Please make sure to read the second half of <#953993848374325269> XV if you have enough knowledge, otherwise, the first half applies.",
							"inline": false
						}
					],
					"footer": {
						"text": "",
						"icon_url": ""
					},
					"image": {
						"url": ""
					},
					"thumbnail": {
						"url": "https://cdn.discordapp.com/icons/952946952348270622/d011f1dc1d27e9001d243bdedaf7443b.webp?size=512"
					},
					"author": {
						"name": "",
						"icon_url": "",
						"url": ""
					}
				}
			}
		},
		{
			"includes": {
				"channels": [952946952348270626, 954147049832603748],
				"match": ["(?i)(((sponsor|sponcer).*){1,}((no|work).*){2,})"]
			},
			"excludes": {
				"roles": [
					965267139902705744, 955220417969262612, 952987191401926697,
					1027874293192863765
				],
				"match": []
			},
			"condition": {
				"user": {
					"server_age": 120
				}
			},
			"response": {
				"embed": {
					"title": "SponsorBlock does not work ‚ùì",
					"description": "You have asked a question that has been answered in the <#953993848374325269> channel already. Make sure to read it as it will answer a lot of your questions guaranteed.",
					"color": 14908858,
					"fields": [
						{
							"name": "üî∏ Regarding your question",
							"value": "Please refer to <#953993848374325269> XXX.",
							"inline": false
						}
					],
					"footer": {
						"text": "",
						"icon_url": ""
					},
					"image": {
						"url": ""
					},
					"thumbnail": {
						"url": "https://cdn.discordapp.com/icons/952946952348270622/d011f1dc1d27e9001d243bdedaf7443b.webp?size=512"
					},
					"author": {
						"name": "",
						"icon_url": "",
						"url": ""
					}
				}
			}
		},
		{
			"includes": {
				"channels": [952946952348270626, 954147049832603748],
				"match": ["vanced\\s*\\.io"]
			},
			"excludes": {
				"roles": [
					965267139902705744, 955220417969262612, 952987191401926697,
					1027874293192863765
				],
				"match": []
			},
			"condition": {
				"user": {
					"server_age": 365
				}
			},
			"response": {
				"embed": {
					"title": "What are the official links of ReVanced‚ùì",
					"description": "A list of official links can be found in <#954066838856273960>.",
					"color": 14908858,
					"fields": [
						{
							"name": "üî∏ Regarding your question",
							"value": "ReVanced is always available at [revanced.app](https://revanced.app).",
							"inline": false
						}
					],
					"footer": {
						"text": "",
						"icon_url": ""
					},
					"image": {
						"url": ""
					},
					"thumbnail": {
						"url": "https://cdn.discordapp.com/icons/952946952348270622/d011f1dc1d27e9001d243bdedaf7443b.webp?size=512"
					},
					"author": {
						"name": "",
						"icon_url": "",
						"url": ""
					}
				}
			}
		}
	]
}
